#CODE;ENGLISH;;;;;;;;;;;;;x;;;;
lmmial_army_leader_m;Leading an army;;;;;;;;;;;;;x;;;;
desc_lmmial_army_leader_m;This character is leading an army, a prestigious duty, but which leaves less time to focus on other tasks...;;;;;;;;;;;;;x;;;;
lmmial_army_leader_ai_m;Leading an army;;;;;;;;;;;;;x;;;;
desc_lmmial_army_leader_ai_m;This character is leading an army, a prestigious duty, but which leaves less time to focus on other tasks...;;;;;;;;;;;;;x;;;;
lmmial_war_cowardice_m;Shying Away From Battle;;;;;;;;;;;;;x;;;;
desc_lmmial_war_cowardice_m;This character is a primary attacker or defender in a war but neither leads armies personally nor puts a close relative or spouse in charge of an army. A cowardly show indeed!;;;;;;;;;;;;;x;;;;